numero,tema,pregunta,respuestas,respuestas_correctas
1,Tema 1,¿Cuáles son características del Sofware?,a) Es intangible;b) Se fabrica;c) No se estropea;d) Requiere Mantenimiento;e) Se desarrolla,a) Es intangible;c) No se estropea;d) Requiere Mantenimiento;e) Se desarrolla
2,Tema 1,¿Cuáles son tipos de Software según su desarrollo?,a) A medida (proyecto interno);b) Producto (market-driven);c) Software Libre;d) Videojuegos;e) Telecomunicaciones,a) A medida (proyecto interno);b) Producto (market-driven);c) Software Libre
3,Tema 1,¿Cuáles son ejemplos de evolución del Hardware?,a) Microprocesador;b) Circuitos integrados;c) Interfaces gráficas de usuario;d) Válculas de vacío; e) Redes de Computadores,a) Microprocesador;b) Circuitos integrados;d) Circuitos integrados;e) Redes de Computadores
4,Tema 1,¿Cuáles son algunos problemas comunes en la industria del Software?,a) Sobrecostes;b) Retrasos en los Proyectos;c) Baja calidad del Software;d) Demasiado Hardware obsoleto;e) Mantenimiento complejo,a) Sobrecostes;b) Retrasos en los Proyectos;c) Baja calidad del Software;e) Mantenimiento 
5,Tema 1,¿Cuáles son causas de fracasos en proyectos de software según el CHAOS Report?,a) Requisitos incompletos;b) Expectativas no realistas;c) Especificaciones cambiantes;d) Apoyo insuficiente de los directivos;e) Hitos del proyecto pequeños,a) Requisitos incompletos;b) Expectativas no realistas;c) Especificaciones cambiantes
1,Tema 2,¿Qué incluye el ciclo de vida del software según ISO 12207?,a) Procesos;b) Actividades;c) Tareas;d) Herramientas;e) Equipos,a) Procesos;b) Actividades;c) Tareas;d) Herramientas;e) Equipos